user_input,retrieved_contexts,response,reference,faithfulness,answer_relevancy,context_precision,context_recall
What is the net salary?,"['PI No.: 13311298J093\nHI Fund: VDEK/TKK\nDEUEV Key: 0100\nSI Days: 30.00\nDate of Birth: Dec 31, 1998\nEntry: Oct 20, 2025\nLeaving:\nTaxExmptChld: 0.0\nAnnual Exmpt: 0.00\nMthly Exmpt: 0.00\nAnnual Add.Amt: 0.00\nMthly Add.Amt: 0.00\nHI Rate:\nPI Rate: 9.30 %\nUI Rate:\nCI Rate:\nBonus/Midij./Conc. Empl.: //\nFor period  01.12. to 31.12.2025:\n2000 Hourly Rate LSG       48.22         12.82        618.18  \nGross Remuneration \n/10E Total Gross (EBeschV)       618.18       1,394.94', 'Flink Expansion 4 GmbH \nBrunnenstraße 19 - 21, 10119 Berlin\nKazi Akib Javed\nHeiligenstadter Str. 8\n13055 Berlin\nWage Type Indic. For Number Amt/Unit Addit. Amount Annual Value\nIn December 2025\nDate: 06.01.2026\nPage: 1/1\nPayslip\nPersonal Data/Organizational Data\nPersonnel No.: 10085279\nCost Center: 1000025125\nPS Grp/\nLevel:\xa0\xa0\xa0\xa0\xa0\xa0\xa0\xa0\xa0\xa0\xa0HOURLY/NO\nTax Class: 6\nFactor: 0.000\nReligion EE/ER:\xa0\xa0\xa0\xa0 --/\nTax Days: 30.00\nBase Rate Priv. SI: 0.00\nTax ID: 00000000000\nPI No.: 13311298J093\nHI Fund: VDEK/TKK', 'Payments and Deductions \n3355 Bring Your Own Device         3.60  \n9310 Tip (paid separately)       100.00  \n9311 Tip Lieferando (paid sep)        22.00  \nPayments\nBank Transfer       496.21 EUR\nBank Details: Kazi Akib Javed IBAN: DE50 3104 0015 0840 9765 00\nIndicator: (E) Non-Recurring Payment, (L) Liable to Employment Tax, (S) Liable to Social Insurance, (G) Overall Gross Amount, (Z) \nGross Amount Liable for SP Gross', 'SBRE Gross Tax, NrP        50.00  \nSBRL Gross Tax, Regular       618.18       1,344.94  \nRBRE PI Gross, NrP        50.00  \nRBRL PI Gross, Reg.       618.18       1,344.94  \nStatutory Deductions \nLSTE Employment Tax, NrP         6.00  \nLSTL Employment Tax, Reg.        68.08        148.10  \nRANE Pension Insurance, NrP         4.65  \nRANL Pension Insurance, Reg.        57.49        125.08  \nNet\n/55E Statutory Net (EBeschV)       492.61  \nPayments and Deductions', 'Gross Amount Liable for SP Gross \nStatement according to § 108, paragraph 3, clause 1 of the German Industrial Code']",The net salary is 492.61 EUR.,The net salary is 492.61 EUR,,,0.499999999975,
What is the hourly rate?,"['PI No.: 13311298J093\nHI Fund: VDEK/TKK\nDEUEV Key: 0100\nSI Days: 30.00\nDate of Birth: Dec 31, 1998\nEntry: Oct 20, 2025\nLeaving:\nTaxExmptChld: 0.0\nAnnual Exmpt: 0.00\nMthly Exmpt: 0.00\nAnnual Add.Amt: 0.00\nMthly Add.Amt: 0.00\nHI Rate:\nPI Rate: 9.30 %\nUI Rate:\nCI Rate:\nBonus/Midij./Conc. Empl.: //\nFor period  01.12. to 31.12.2025:\n2000 Hourly Rate LSG       48.22         12.82        618.18  \nGross Remuneration \n/10E Total Gross (EBeschV)       618.18       1,394.94', 'Payments and Deductions \n3355 Bring Your Own Device         3.60  \n9310 Tip (paid separately)       100.00  \n9311 Tip Lieferando (paid sep)        22.00  \nPayments\nBank Transfer       496.21 EUR\nBank Details: Kazi Akib Javed IBAN: DE50 3104 0015 0840 9765 00\nIndicator: (E) Non-Recurring Payment, (L) Liable to Employment Tax, (S) Liable to Social Insurance, (G) Overall Gross Amount, (Z) \nGross Amount Liable for SP Gross', 'Flink Expansion 4 GmbH \nBrunnenstraße 19 - 21, 10119 Berlin\nKazi Akib Javed\nHeiligenstadter Str. 8\n13055 Berlin\nWage Type Indic. For Number Amt/Unit Addit. Amount Annual Value\nIn December 2025\nDate: 06.01.2026\nPage: 1/1\nPayslip\nPersonal Data/Organizational Data\nPersonnel No.: 10085279\nCost Center: 1000025125\nPS Grp/\nLevel:\xa0\xa0\xa0\xa0\xa0\xa0\xa0\xa0\xa0\xa0\xa0HOURLY/NO\nTax Class: 6\nFactor: 0.000\nReligion EE/ER:\xa0\xa0\xa0\xa0 --/\nTax Days: 30.00\nBase Rate Priv. SI: 0.00\nTax ID: 00000000000\nPI No.: 13311298J093\nHI Fund: VDEK/TKK', 'Gross Amount Liable for SP Gross \nStatement according to § 108, paragraph 3, clause 1 of the German Industrial Code']",The hourly rate is 48.22.,The hourly rate is 48.22 EUR,,0.9999999999999998,,1.0
What is the employment tax deduction?,"['SBRE Gross Tax, NrP        50.00  \nSBRL Gross Tax, Regular       618.18       1,344.94  \nRBRE PI Gross, NrP        50.00  \nRBRL PI Gross, Reg.       618.18       1,344.94  \nStatutory Deductions \nLSTE Employment Tax, NrP         6.00  \nLSTL Employment Tax, Reg.        68.08        148.10  \nRANE Pension Insurance, NrP         4.65  \nRANL Pension Insurance, Reg.        57.49        125.08  \nNet\n/55E Statutory Net (EBeschV)       492.61  \nPayments and Deductions', 'Payments and Deductions \n3355 Bring Your Own Device         3.60  \n9310 Tip (paid separately)       100.00  \n9311 Tip Lieferando (paid sep)        22.00  \nPayments\nBank Transfer       496.21 EUR\nBank Details: Kazi Akib Javed IBAN: DE50 3104 0015 0840 9765 00\nIndicator: (E) Non-Recurring Payment, (L) Liable to Employment Tax, (S) Liable to Social Insurance, (G) Overall Gross Amount, (Z) \nGross Amount Liable for SP Gross', 'Gross Amount Liable for SP Gross \nStatement according to § 108, paragraph 3, clause 1 of the German Industrial Code', 'Flink Expansion 4 GmbH \nBrunnenstraße 19 - 21, 10119 Berlin\nKazi Akib Javed\nHeiligenstadter Str. 8\n13055 Berlin\nWage Type Indic. For Number Amt/Unit Addit. Amount Annual Value\nIn December 2025\nDate: 06.01.2026\nPage: 1/1\nPayslip\nPersonal Data/Organizational Data\nPersonnel No.: 10085279\nCost Center: 1000025125\nPS Grp/\nLevel:\xa0\xa0\xa0\xa0\xa0\xa0\xa0\xa0\xa0\xa0\xa0HOURLY/NO\nTax Class: 6\nFactor: 0.000\nReligion EE/ER:\xa0\xa0\xa0\xa0 --/\nTax Days: 30.00\nBase Rate Priv. SI: 0.00\nTax ID: 00000000000\nPI No.: 13311298J093\nHI Fund: VDEK/TKK']","According to the provided information, the employment tax deductions are:

- For NrP (Numbered Personnel): 6.00 EUR (LSTE Employment Tax, NrP)
- For Regular: 68.08 EUR (LSTL Employment Tax, Reg.) and 148.10 EUR (LSTL Employment Tax, Reg.)",The employment tax deduction is 68.08 EUR,,0.953635912747995,,
What is the pension insurance deduction?,"['SBRE Gross Tax, NrP        50.00  \nSBRL Gross Tax, Regular       618.18       1,344.94  \nRBRE PI Gross, NrP        50.00  \nRBRL PI Gross, Reg.       618.18       1,344.94  \nStatutory Deductions \nLSTE Employment Tax, NrP         6.00  \nLSTL Employment Tax, Reg.        68.08        148.10  \nRANE Pension Insurance, NrP         4.65  \nRANL Pension Insurance, Reg.        57.49        125.08  \nNet\n/55E Statutory Net (EBeschV)       492.61  \nPayments and Deductions', 'Payments and Deductions \n3355 Bring Your Own Device         3.60  \n9310 Tip (paid separately)       100.00  \n9311 Tip Lieferando (paid sep)        22.00  \nPayments\nBank Transfer       496.21 EUR\nBank Details: Kazi Akib Javed IBAN: DE50 3104 0015 0840 9765 00\nIndicator: (E) Non-Recurring Payment, (L) Liable to Employment Tax, (S) Liable to Social Insurance, (G) Overall Gross Amount, (Z) \nGross Amount Liable for SP Gross', 'PI No.: 13311298J093\nHI Fund: VDEK/TKK\nDEUEV Key: 0100\nSI Days: 30.00\nDate of Birth: Dec 31, 1998\nEntry: Oct 20, 2025\nLeaving:\nTaxExmptChld: 0.0\nAnnual Exmpt: 0.00\nMthly Exmpt: 0.00\nAnnual Add.Amt: 0.00\nMthly Add.Amt: 0.00\nHI Rate:\nPI Rate: 9.30 %\nUI Rate:\nCI Rate:\nBonus/Midij./Conc. Empl.: //\nFor period  01.12. to 31.12.2025:\n2000 Hourly Rate LSG       48.22         12.82        618.18  \nGross Remuneration \n/10E Total Gross (EBeschV)       618.18       1,394.94', 'Gross Amount Liable for SP Gross \nStatement according to § 108, paragraph 3, clause 1 of the German Industrial Code', 'Flink Expansion 4 GmbH \nBrunnenstraße 19 - 21, 10119 Berlin\nKazi Akib Javed\nHeiligenstadter Str. 8\n13055 Berlin\nWage Type Indic. For Number Amt/Unit Addit. Amount Annual Value\nIn December 2025\nDate: 06.01.2026\nPage: 1/1\nPayslip\nPersonal Data/Organizational Data\nPersonnel No.: 10085279\nCost Center: 1000025125\nPS Grp/\nLevel:\xa0\xa0\xa0\xa0\xa0\xa0\xa0\xa0\xa0\xa0\xa0HOURLY/NO\nTax Class: 6\nFactor: 0.000\nReligion EE/ER:\xa0\xa0\xa0\xa0 --/\nTax Days: 30.00\nBase Rate Priv. SI: 0.00\nTax ID: 00000000000\nPI No.: 13311298J093\nHI Fund: VDEK/TKK']","For the Regular tax class, the pension insurance deduction is 57.49 EUR.",The pension insurance deduction is 57.49 EUR,,,,
What is the gross remuneration?,"['Gross Amount Liable for SP Gross \nStatement according to § 108, paragraph 3, clause 1 of the German Industrial Code', 'PI No.: 13311298J093\nHI Fund: VDEK/TKK\nDEUEV Key: 0100\nSI Days: 30.00\nDate of Birth: Dec 31, 1998\nEntry: Oct 20, 2025\nLeaving:\nTaxExmptChld: 0.0\nAnnual Exmpt: 0.00\nMthly Exmpt: 0.00\nAnnual Add.Amt: 0.00\nMthly Add.Amt: 0.00\nHI Rate:\nPI Rate: 9.30 %\nUI Rate:\nCI Rate:\nBonus/Midij./Conc. Empl.: //\nFor period  01.12. to 31.12.2025:\n2000 Hourly Rate LSG       48.22         12.82        618.18  \nGross Remuneration \n/10E Total Gross (EBeschV)       618.18       1,394.94', 'SBRE Gross Tax, NrP        50.00  \nSBRL Gross Tax, Regular       618.18       1,344.94  \nRBRE PI Gross, NrP        50.00  \nRBRL PI Gross, Reg.       618.18       1,344.94  \nStatutory Deductions \nLSTE Employment Tax, NrP         6.00  \nLSTL Employment Tax, Reg.        68.08        148.10  \nRANE Pension Insurance, NrP         4.65  \nRANL Pension Insurance, Reg.        57.49        125.08  \nNet\n/55E Statutory Net (EBeschV)       492.61  \nPayments and Deductions', 'Payments and Deductions \n3355 Bring Your Own Device         3.60  \n9310 Tip (paid separately)       100.00  \n9311 Tip Lieferando (paid sep)        22.00  \nPayments\nBank Transfer       496.21 EUR\nBank Details: Kazi Akib Javed IBAN: DE50 3104 0015 0840 9765 00\nIndicator: (E) Non-Recurring Payment, (L) Liable to Employment Tax, (S) Liable to Social Insurance, (G) Overall Gross Amount, (Z) \nGross Amount Liable for SP Gross']",The gross remuneration is 618.18.,The gross remuneration is 618.18 EUR,,,0.5833333333041666,1.0
